{
  "id": "purpleplanen",
  "name": "Purple Planen",
  "intro": "Developer & Anime fan",
  "avatar": "https://avatars.githubusercontent.com/u/151366823?v=4",
  "tags": ["developer", "designer"],
  "links": {
    "github": "https://github.com/purpleplanen",
    "blog": "https://purpleplanen.top"
  }
}
